문제,문항1,문항2,문항3,문항4,정답
두 말을 이어 주거나 열거할 때 쓰이는 말들의 띄어쓰기 원칙으로 옳은 것은?,항상 붙여 쓴다.,띄어 쓴다.,명사만 이어줄 때 띄어 쓴다.,짧은 단어일 경우 붙여 쓴다.,2
보조 용언의 띄어쓰기 원칙으로 옳은 것은?,항상 붙여 쓴다.,항상 띄어 쓴다.,띄어 쓰는 것을 원칙으로 하되 경우에 따라 붙여 씀도 허용한다.,아시아경제 표기원칙에서는 하나의 기사 안에서 보조 용언을 항상 띄어 쓰는 것으로 통일한다.,3
성과 직위 성과 호칭의 띄어쓰기 원칙으로 옳은 것은?,성과 직위는 붙여 쓰고 성과 호칭은 띄어 쓴다.,성과 호칭(씨ㆍ군ㆍ양ㆍ옹)은 붙여 쓰고 관직명(회장ㆍ사장ㆍ위원장 등)은 띄어 쓴다.,성명 이외의 고유 명사는 항상 붙여 쓴다.,성명 이외의 고유 명사는 단어별로 띄어 쓴다.,2
성명 이외의 고유 명사 띄어쓰기 원칙으로 옳은 것은?,항상 붙여 쓰는 것을 원칙으로 한다.,단어별로 띄어 씀을 원칙으로 하되 단위별로 띄어 쓸 수 있다.,널리 알려진 고유 명사는 붙여 쓴다.,음절 수가 많을수록 띄어 쓴다.,2
법률 군사 등 전문 용어의 띄어쓰기 원칙으로 옳은 것은?,항상 붙여 쓴다.,항상 띄어 쓴다.,단어별로 띄어 씀을 원칙으로 하되 붙여 쓸 수 있다.,한 단어로 굳어진 경우에만 붙여 쓴다.,3
보조 용언이 앞말에 조사가 붙거나 앞말이 합성 동사인 경우 중간에 조사가 들어갈 때의 띄어쓰기 원칙은?,그 뒤에 오는 보조 용언은 항상 붙여 쓴다.,그 뒤에 오는 보조 용언은 띄어 쓴다.,‘-아 / 어’ 뒤에 연결되는 보조 용언은 항상 붙여 쓴다.,보조 용언의 의미에 따라 띄어쓰기가 달라진다.,2
‘못하다’가 ‘어떤 일을 일정한 수준에 못 미치게 한다’는 뜻으로 쓰일 때의 띄어쓰기 원칙은?,붙여 쓴다.,띄어 쓴다.,앞 단어에 ‘-지’ 접미가 있는 경우는 띄어 쓴다.,노래를 못 한다(노래를 할 수 없다)'의 경우도 붙여 쓴다.,1
‘안 하다’의 띄어쓰기 원칙으로 옳은 것은?,항상 붙여 쓴다.,모두 띄어 써야 한다.,안되다'와 동일하게 적용한다.,문장의 길이가 길어질 때만 띄어 쓴다.,2
보조 동사 ‘내다’가 한 음절의 말에 붙어 굳어진 경우의 띄어쓰기 원칙은?,항상 띄어 쓴다.,붙여 쓴다.,퍼 내다' '빼 내다'와 같이 띄어 쓰는 것이 원칙이다.,내다'가 동사로 쓰일 때만 붙여 쓴다.,2
‘하다 되다 시키다 받다’와 같은 접미사 앞에 오는 단어가 서술성이나 행위성을 가진 경우의 띄어쓰기 원칙은?,항상 띄어 쓴다.,붙여 쓴다.,봉변 당하다'와 같이 '당하다'는 띄어 쓰는 것이 원칙이다.,품사가 변경되는 경우에만 붙여 쓴다.,2
부사형 어미 ‘와/워 아/어’에 ‘하다’가 붙어 품사가 변경됐을 때의 띄어쓰기 원칙은?,항상 띄어 쓴다.,붙여 쓴다.,고마워 하다' '아파 하다'와 같이 띄어 쓰는 것이 원칙이다.,하다'가 동사로 쓰일 때만 붙여 쓴다.,2
관형사 ‘이 그 저 아무’가 다음 말에 붙여 쓰는 경우가 아닌 것은?,이것 그것 저것,아무것 이곳 그곳 저곳,이때 그때,저때 아무때 아무곳.,4
‘몇’이 의문의 뜻을 나타내는 경우와 ‘얼마 되지 않는 수’의 의미로 수사로 쓰일 때의 띄어쓰기 원칙은?,의문의 뜻일 때는 붙여 쓰고 수사일 때는 띄어 쓴다.,의문의 뜻일 때는 관형사로 띄어 쓰고 수사일 때는 앞이나 뒤에 붙는 수를 나타내는 단어와 붙여 쓴다.,항상 붙여 쓴다.,항상 띄어 쓴다.,2
‘~가량’이 수량을 나타내는 명사 또는 명사구 뒤에 붙어 ‘정도’의 뜻을 더하는 접미사일 경우의 띄어쓰기 원칙은?,항상 띄어 쓴다.,붙여 쓴다.,한 시간 가량'과 같이 띄어 쓰는 것이 원칙이다.,숫자 뒤에만 붙여 쓴다.,2
첩어와 준첩어 의성어 의태어 등의 띄어쓰기 원칙으로 옳은 것은?,항상 띄어 쓴다.,붙여 쓴다.,곱게 곱게'처럼 반복되는 형태는 띄어 쓴다.,들락 날락'과 같이 음절이 두 개일 때는 띄어 쓴다.,2
접두사가 붙은 파생어의 띄어쓰기 원칙으로 옳은 것은?,항상 띄어 쓴다.,원칙적으로 붙여 쓴다.,이해하기 어려운 경우에만 띄어 쓴다.,관형사로 인정되는 것은 항상 붙여 쓴다.,2
‘-별’이 ‘그것에 따른’을 뜻하며 ‘-하’가 ‘그것과 관련된 조건이나 환경’을 뜻하는 접미사일 경우의 띄어쓰기 원칙은?,모두 띄어 쓴다.,모두 붙여 쓴다.,직렬 별로' '관리 하에'와 같이 띄어 쓰는 것이 원칙이다.,별'은 붙여 쓰고 '하'는 띄어 쓴다.,2
"의존명사 ‘척 체 양 만 듯 뻔 법’ 뒤에 ‘하다’가 붙을 때의 띄어쓰기 원칙은?,항상 띄어 쓴다.",붙여 쓴다.,만들 법 하다',놓칠 뻔 하다'와 같이 띄어 쓰는 것이 원칙이다.,척한다'만 붙여 쓴다.,2
의존명사 ‘중(中) 둥 등 리(이유) 때문 따위 수 바람(차림) 내(內) 체(척:흉내) 겸’ 등의 띄어쓰기 원칙은?,항상 붙여 쓴다.,띄어 쓴다.,월초' '연말' '연내' 등은 띄어 쓰는 것이 원칙이다.,이 중'은 붙여 쓴다.,2
‘뿐’이 의존명사로 쓰일 때와 조사로 쓰일 때의 띄어쓰기 원칙으로 옳은 것은?,의존명사로 쓰일 때는 붙여 쓰고 조사로 쓰일 때는 띄어 쓴다.,의존명사로 쓰일 때는 띄어 쓰고 조사로 쓰일 때는 붙여 쓴다.,항상 붙여 쓴다.,항상 띄어 쓴다.,2
‘만’이 시간과 관련된 단어 뒤에 쓰여 ‘얼마 동안 계속됐다’는 뜻으로 쓰일 때의 띄어쓰기 원칙은?,항상 붙여 쓴다.,띄어 쓴다.,두 시간만에'와 같이 붙여 쓰는 것이 원칙이다.,오랜만에'는 띄어 쓴다.,2
‘데’가 ‘장소 경우 일 것’ 등의 뜻으로 쓰일 때의 띄어쓰기 원칙은?,항상 붙여 쓴다.,띄어 쓴다.,연결형 어미로 쓰일 때만 띄어 쓴다.,~ㄴ(은ㆍ는ㆍ던)데' 형태로 쓰일 때도 띄어 쓴다.,2
‘간(間)’이 ‘무엇과 무엇 사이’의 뜻일 때와 ‘얼마 동안’이란 뜻일 때의 띄어쓰기 원칙은?,‘무엇과 무엇 사이’일 때는 붙여 쓰고 ‘얼마 동안’일 때는 띄어 쓴다.,‘무엇과 무엇 사이’일 때는 띄어 쓰고 ‘얼마 동안’일 때는 붙여 쓴다.,항상 붙여 쓴다.,항상 띄어 쓴다.,2
‘시(時)’가 ‘어떤 일이나 현상이 일어날 때나 경우’를 나타내는 의존명사로 쓰일 때의 띄어쓰기 원칙은?,항상 붙여 쓴다.,한글맞춤법에서 허용한 경우를 제외하고는 띄어 쓴다.,만기 시' '출입 시'는 붙여 쓰는 것이 원칙이다.,필요시 유사시 비상시'는 띄어 쓰는 것이 원칙이다.,2
형용사 ‘같다’에서 어미 ‘은’이 붙은 형태로 쓰이는 ‘같은’과 부사로 쓰이는 ‘같이’의 띄어쓰기 원칙은?,‘같은’은 붙여 쓰고 ‘같이’는 띄어 쓴다.,‘같은’은 띄어 쓰고 ‘같이’는 붙여 쓴다.,둘 다 항상 붙여 쓴다.,이 같은'은 붙여 쓰고 '이같이'는 띄어 쓴다.,2
다음 중 한 단어이므로 붙여 쓰는 것이 원칙인 것은?,지난 주말,다음 주,이번 달,지난주.,4
다음 중 아시아경제신문의 외래어 표기 원칙에 대한 설명으로 올바르지 않은 것은 무엇입니까?,외래어는 국어의 현용 24 자모만으로 적는 것을 원칙으로 한다.,외래어의 1 음운은 원칙적으로 1 기호로 적는다.,받침에는 ‘ㄱ ㄴ ㄹ ㅁ ㅂ ㅅ ㅇ’만을 쓴다.,파열음 표기에는 된소리(ㄲㆍㄸㆍㅃㆍㅆㆍㅉ)를 쓰는 것을 원칙으로 한다.,4
다음 중 아시아경제신문의 외래어 표기 원칙에 따라 올바르게 표기된 것은 무엇입니까?,노우하우,윈도우,노하우,섀도우,3
아시아경제신문 외래어 표기 원칙에 따르면 복수를 나타내는 영어 's'와 'th' 발음은 어떻게 적어야 합니까?,즈,드,쓰,스,4
다음 중 어말의 's' 표기에 대한 설명으로 올바른 것은 무엇입니까?,어말의 's'는 항상 '즈'로 표기한다.,뉴욕타임스'는 '뉴욕타임즈'로 표기하는 것이 원칙이다.,렌즈' '시리즈''슈즈' 등 굳어진 관용표현은 예외적으로 인정한다.,어말의 's'는 '스'로 적되 예외는 인정하지 않는다.,3
다음 중 'mm' 'nn' 등 두 개의 글자가 겹치는 외래어의 표기 원칙에 따라 올바르게 표기된 것은 무엇입니까?,러닝(running),커닝(cunning),해머(hammer),이 모든 경우에 하나만 표기하는 것이 원칙이다.,4
아시아경제신문 외래어 표기 원칙에 따라 영어 ‘l’과 ‘r’ 발음은 각각 어떻게 표기합니까?,‘l’은 ‘르’ ‘r’은 ‘ㄹㄹ’,‘l’은 ‘ㄹㄹ’ ‘r’은 ‘ㄹ’,‘l’은 ‘ㄹ’ ‘r’은 ‘르’,‘l’은 ‘ㄹㄹ’ ‘r’은 ‘르’,2
아시아경제신문 외래어 표기 원칙에 따르면 [f] 발음은 어떻게 표기합니까?,프,브,ㅍ,비,3
다음 중 어말의 ‘a’ 표기 원칙에 따라 올바르게 표기된 것은 무엇입니까?,소파(sofa),판다(panda),파카(parka),이 모든 경우에 ‘아’로 표기한다.,4
다음 중 영어 ‘Mac-’ ‘Mc-’ 접두사의 표기 원칙이 올바르지 않은 것은 무엇입니까?,자음 앞에서는 ‘맥’으로 적는다.,모음 앞에서는 ‘매크’로 적는다.,‘c’나 ‘k’ ‘q’ 앞에서는 ‘매’로 적는다.,‘l’ 앞에서는 ‘매’로 적는다.,4
아시아경제신문 외래어 표기 원칙에 따르면 두 개의 단어가 합쳐져 이뤄진 합성 외래어는 어떻게 표기해야 합니까?,줄임말 형태로 표기한다.,본래의 단어를 합쳐서 새로운 단어로 표기한다.,본래의 단어를 살려서 표기한다.,의미가 통하면 어떤 형태로든 표기할 수 있다.,3
다음 중 일본어 표기 원칙에 따라 어두에 'ㅊ ㅋ ㅌ'을 쓰지 않는 예시로 올바른 것은 무엇입니까?,치바 → 치바,큐슈 → 큐슈,토쿄 → 도쿄,모두 어두에 'ㅊ ㅋ ㅌ'을 쓸 수 있다.,3
아시아경제신문 외래어 표기 원칙에 따르면 일본어에서 ‘츠’나 ‘쯔’로 표기되는 소리는 어떻게 적어야 합니까?,츠,쯔,쓰,스,3
동남아시아 중국의 지명 표기 원칙에 대한 설명으로 올바른 것은 무엇입니까?,된소리(ㄲㆍㄸㆍㅃㆍㅆㆍㅉ)를 인정하지 않는다.,호치민'은 '호찌민'으로 표기할 수 없다.,푸켓'은 '푸껫'으로 '양자강'은 '양쯔강'으로 표기할 수 있다.,오직 현지 발음만을 따른다.,3
다음 중 괄호 안에 영어를 표기할 때의 원칙으로 올바른 것은 무엇입니까?,항상 대문자로 쓴다.,항상 소문자로 쓴다.,고유명사도 소문자로 쓴다.,소문자로 쓰는 것이 원칙이지만 고유명사는 대문자로 쓴다.,4
다음 중 'ㅈ ㅊ' 발음에 대한 외래어 표기 원칙에 따라 올바르게 표기된 것은 무엇입니까?,벤쳐,제스쳐,텔레비전,셰익스피어는 예외이다.,3
다음 중 '하이라이트(highlight)'와 '데드라인(deadline)'과 같이 두 단어가 합쳐진 합성 외래어의 올바른 표기는 무엇입니까?,하이-라이트 데드-라인,하이라잇 데드라인,하이라이트 데드라인,하이라이트-점 데드라인-선,3
아시아경제신문 외래어 표기 원칙에 따르면 영어 단어를 잇는 ‘-’(하이픈)는 한글 사이에서 어떻게 표기합니까?,반드시 표기한다.,때에 따라 표기할 수 있다.,표기하지 않는다.,영어 단어 표기 그대로 유지한다.,3
다음 중 올바른 외래어 표기는 무엇입니까?,노블리스 오블리제,노블레스 오블리주,노블레스 오블리스,노블레스 오블리주,2
다음 중 올바른 외래어 표기는 무엇입니까?,라이센스,라이센쓰,라이선스,라이선쓰,3
다음 중 올바른 외래어 표기는 무엇입니까?,류마티스,류머티쓰,류머티즘,류머티스,3
다음 중 올바른 외래어 표기는 무엇입니까?,런칭,론칭,런치,론치,2
다음 중 올바른 외래어 표기는 무엇입니까?,렌탈,렌털,렌터,렌털,2
다음 중 올바른 외래어 표기는 무엇입니까?,로얄,로이알,로열,로얄티,3
다음 중 올바른 외래어 표기는 무엇입니까?,리모콘 에어콘,리모컨 에어컨,리모콘 에어컨,리모컨 에어컨,2
다음 중 올바른 외래어 표기는 무엇입니까?,마이더스,미이다스,미다스,마이다스,3
다음 중 올바른 외래어 표기는 무엇입니까?,맘모스,맘머스,매머드,맘모쓰,3
다음 중 올바른 외래어 표기는 무엇입까?,미스테리,미스터리,미스테뤼,미스터리,2
다음 중 올바른 외래어 표기는 무엇입니까?,비지니스,비즈니스,비지네스,비즈니스,2
다음 중 올바른 외래어 표기는 무엇입습니까?,샤베트,셔베트,샤벗,셔벗,4
다음 중 올바른 외래어 표기는 무엇입니까?,세레모니,세러모니,세리머니,세리모니,3
다음 중 올바른 외래어 표기는 무엇입니까?,수트,슈트,슈우트,슈트,2
다음 중 올바른 외래어 표기는 무엇입니까?,쉐프,셰프,쉐프(chef),셰프,2
다음 중 올바른 외래어 표기는 무엇입니까?,쉽,십,쉬입,시프,2
다음 중 올바른 외래어 표기는 무엇입니까?,스왚,스왑,스와프,스와프(swap),3
다음 중 올바른 외래어 표기는 무엇입니까?,스테인레스,스테인리스,스테인레쓰,스테인리쓰,2
다음 중 올바른 외래어 표기는 무엇입니까?,아울렛,아웃렛,아울레트,아웃렛,2
다음 중 올바른 외래어 표기는 무엇입니까?,악세서리,악새서리,액세서리,악서사리,3
다음 중 올바른 외래어 표기는 무엇입니까?,아젠다,아잰다,어젠다,어젠다(agenda),3
다음 중 올바른 외래어 표기는 무엇입니까?,엣지,에찌,에지,엣쥐,3
다음 중 올바른 외래어 표기는 무엇입니까?,쥬얼리,주어리,주얼리,쥬어리,3
다음 중 올바른 외래어 표기는 무엇입니까?,컨셉,컨셉트,콘셥,콘셉트,4
다음 중 올바른 외래어 표기는 무엇입까?,콜렉션,컬렉숀,컬렉션,컬랙션,3
다음 중 올바른 외래어 표기는 무엇입니까?,탑,톱,턉,텃,2
다음 중 올바른 외래어 표기는 무엇입니까?,테라피,테라피(therapy),세러피,세라피,3
다음 중 올바른 외래어 표기는 무엇입니까?,토탈,토털,토우탈,토올,2
다음 중 올바른 외래어 표기는 무엇입니까?,판넬,패널,판넬(panel),파넬,2
다음 중 올바른 외래어 표기는 무엇입니까?,플렉서블,플렉시불,플렉시블,플렉서불,3
다음 중 올바른 외래어 표기는 무엇입니까?,휘트니스,휘트니스(fitness),피트네스,피트니스,4
다음 중 올바른 외래어 표기는 무엇입니까?,프리젠테이션,프리젠테이숀,프레젠테이션,프레젠테이숀,3
다음 중 외래어 표기법에 따른 외국 인명 표기 원칙으로 옳은 것은?,현지음이 아닌 제 3 국의 발음으로 통용되는 것은 예외 없이 현지음으로 표기한다.,외국인명은 원칙적으로 현지음대로 표기한다.,된소리 표기는 모든 외국어 인명에 허용하지 않는다.,미들네임은 어떠한 경우에도 생략하지 않는다.,2
다음 중 아시아경제신문 스타일 북의 외래어 표기 원칙에 따라 올바르게 표기된 인명은?,간디 (Gandhi),헤이그 (Hague),시져 (Caesar),앙카라 (Ankara),1
중국 인명 표기에 대한 설명 중 옳은 것은?,모든 중국 인명은 현지음대로 표기한다.,1911 년 신해혁명 이후의 인명은 한자음대로 표기한다.,1911 년 신해혁명을 기준으로이전 인명은 한자음대로 이후 인명은 중국어 표기법에 따라 표기한다.,중국 인명은 어떠한 경우에도 한자를 병기하지 않는다.,3
외국인 인명 표기 시 성과 이름의 띄어쓰기 원칙에 맞지 않는 것은?,리커창 (중국),도널드트럼프 (미국),호찌민 (베트남),누르술탄 나자르바예프 (카자흐스탄),2
다음 중 미들네임 표기 원칙에 따라 올바르게 표기된 인명은?,조지 W 부시,O.J.심슨,조지 W. 부시,O J 심슨,3
서양인의 성명 가운데 'Junior'를 표기하는 방법으로 옳은 것은?,Junior,Jr.,Jr,Junior.,3
다음 중 '후진타오'의 올바른 표기는?,후진따오,후진타오,후 진 타오,후진타우,2
다음 중 성과 이름을 붙여 쓰는 외국 인명 표기 원칙에 따라 올바르게 표기된 인명은?,도널드 트럼프 (미국),마크 저커버그 (미국),리커창 (중국),쥐스탱 트뤼도 (캐나다),3
다음 중 '오스트레일리아 골프 선수'의 올바른 표기는?,애덤 스콧 (오스트레일리아 골프선수),애덤스코트 (오스트레일리아 골프선수),아담 스콧 (오스트레일리아 골프선수),애덤 스콭 (오스트레일리아 골프선수),1
다음 중 '베트남'의 '호찌민'의 올바른 표기는?,호치민,호찌민,호지민,호찌 민,2
다음 중 '영국의 디자이너'의 올바른 표기는?,스텔라 매카트니,스텔라 맥카트니,스텔라 맥커트니,스텔라 메카트니,1
다음 중 '독일 대통령'의 올바른 표기는?,프랑크발터 슈타인마이어,프랑크 발터 슈타인마이어,프랭크발터 슈타인마이어,프랑크발터 슈타인 마이어,1
다음 중 '미국 경제학자'의 올바른 표기는?,폴 크루그먼,폴크루그먼,폴 크루만,폴 크루그만,1
다음 중 '러시아 대통령'의 올바른 표기는?,블라디미르 푸틴,블라디미르 푸친,블라디미르 푸틴 씨,블라디미르 푸틴 대통령님,1
다음 중 '튀르키예 대통령'의 올바른 표기는?,레제프 타이이프 에르도안,레제프 타이프 에르도안,레제프 타이이프 에르도안 대통령,레젭 타이이프 에르도안,1
다음 중 '메타 CEO'의 올바른 표기는?,마크 저커버그,마크 주커버그,마크 저커버그 CEO,마크 저크버그,1
다음 중 '영국 작곡가'의 올바른 표기는?,앤드루 로이드 웨버,앤드류 로이드 웨버,앤드루 로이드 웨버 씨,앤드루 로이드 웨버님,1
다음 중 '전 일본 총리'의 올바른 표기는?,아베 신조,아베 신죠,아베 신조 총리,아베 신조님,1
다음 중 '이탈리아 디자이너'의 올바른 표기는?,조르조 아르마니,조르지오 아르마니,조르조 아르마니 씨,조르지오 아르마니 디자이너,1
다음 중 '전 유엔 사무총장'의 올바른 표기는?,이리나 보코바,이리나 보꼬바,이리나 보코바 총장님,이리나 보코바 씨,1
다음 중 '인도네시아 대통령'의 올바른 표기는?,조코 위도도,조코위도도,조코 위도도 대통령님,조꼬 위도도,1
다음 중 '전 캐나다 총리'의 올바른 표기는?,스티븐 하퍼,스티븐 하퍼 총리,스티븐 하퍼님,스티븐 하퍼 씨,1
다음 중 '전 남아프리카공화국 대통령'의 올바른 표기는?,제이컵 주마,제이콥 주마,제이컵 주마님,제이컵 주마씨,1
다음 중 '영국 하원의원'의 올바른 표기는?,테리사 메이,테레사 메이,테리사 메이 의원,테리사 메이님,1
다음 중 '전 콜롬비아 대통령'의 올바른 표기는?,후안 마누엘 산토스,후안 마누엘 산토스 대통령,후안 마누엘 산토스님,후안 마누엘 산토스씨,1
다음 중 '이탈리아 총리'의 올바른 표기는?,마리오 드라기,마리오 드라기 총리,마리오 드라기님,마리오 드라지,1
다음 중 '전 애플 최고디자인책임자'의 올바른 표기는?,조너선 아이브,조나단 아이브,조너선 아이브 최고디자인책임자,조너선 아이브님,1
다음 중 '전 야후 CEO'의 올바른 표기는?,머리사 메이어,머리사 메이어 CEO,머리싸 메이어,머리사 마이어,1
다음 중 '나이키 의장'의 올바른 표기는?,마크 파커,마크 파커 의장,마크 파커님,마크 파카,1
다음 중 '영국 배우'의 올바른 표기는?,틸다 스윈턴,틸다 스윈튼,틸다 스윈턴 배우,틸다 스윈턴 씨,1
다음 중 '미국 배우'의 올바른 표기는?,앤젤리나 졸리,안젤리나 졸리,엔젤리나 졸리,앤젤리나 졸리 씨,1
다음 중 '흑인해방운동가'의 올바른 표기는?,마틴 루서 킹,마틴 루터 킹,마틴 루서 킹님,마틴 루서 킹 씨,1
다음 중 '전 이라크 총리'의 올바른 표기는?,누리 알말리키,누리 알 말리키,누리 알마리키,누리 알말리키 총리님,1
다음 중 '프랑스 국민전선 대표'의 올바른 표기는?,마린 르펜,마린 르펜 대표,마린 르팽,마린 르펜님,1
다음 중 '미국 상원의원'의 올바른 표기는?,마르코 루비오,마르코 루비오 의원,마르코 루비오님,마르꼬 루비오,1
되어'의 올바른 축약 표기는?,되,돼,되여,됭,2
다음 중 아시아경제신문 표기 원칙에 따라 축약하지 않는 단어는?,하여,주어,되어,선보이다,4
따옴표 안의 문장이 '-다(했다 이다 되다 하다 등)'로 끝나는 경우 이어서 사용하는 올바른 인용 표현은?,고,라고,이라며,이고,1
따옴표 안의 문장에서 종결어미를 생략하고 명사로 끝낼 수 있을 때 사용하는 인용 표현은?,고,며,(이)라며,는,3
vs'의 올바른 표기 방식은?,VS,Vs,vs,vS,3
vs'를 본문에 사용하는 것이 허용되는가?,항상 허용된다.,특정 부서의 요청이 있을 때만 허용된다.,되도록 본문에는 적지 않되 제목에 허용한다.,제목을 포함한 모든 경우에 허용된다.,3
&' 기호 앞뒤 단어의 띄어쓰기는 어떻게 하는가?,띄어 쓴다.,붙여 쓴다.,&' 앞에만 띄어 쓴다.,&' 뒤에만 띄어 쓴다.,2
아시아경제신문 표기 원칙에 따라 '5G 통신망'을 표기할 때 '5G' 뒤에 붙는 조사('에' '와' 등)는 어떻게 쓰는가?,5G 에'처럼 숫자를 한국어로 읽은 뒤 조사를 붙인다.,5G 와'처럼 숫자를 영어로 읽지 않고 그대로 붙인다.,파이브지에'처럼 숫자를 영어로 읽은 뒤 조사를 붙인다.,오지에'처럼 숫자를 한국어로 읽은 뒤 조사를 붙인다.,3
사고 기사 표기에서 기본적으로 사용하는 기호와 처리 방식은?,▲에 볼드체,▶에 이탤릭체,◆에 고딕처리,*에 밑줄,3
아시아경제신문 표기 원칙에 따른 사진 바이라인 표기 방식은?,사진출처: OOO 기자,사진=OOO 기자 (본인이 찍은 경우),이미지제공: OOO 스튜디오,사진촬영: OOO,2
사진 바이라인 표기 시 '사진출처' '이미지출처' 등의 표현이 가능한가?,아니오 '사진='만 가능하다.,예 가능하다.,사진출처'만 가능하다.,이미지제공'만 가능하다.,2
홈페이지 주소를 기사 중에 표기할 때 'http://'를 어떻게 처리하는가?,반드시 포함해야 한다.,www.' 앞에만 생략한다.,생략한 나머지 부분을 쓴다.,임의로 선택 가능하다.,3
정부 부처를 기사에서 처음 언급할 때의 표기 원칙은?,줄임말로 쓴다.,부처 명을 다 밝혀 쓴다.,괄호 안에 줄임말을 병기한다.,약어만 사용한다.,2
과학기술정보통신부'의 올바른 줄임말은?,과기부,과기정통부,과학통신부,과정부,2
다음 중 줄임말이 없는 정부 부처는?,고용노동부,국토교통부,교육부,기획재정부,3
행정안전부'의 올바른 줄임말은?,행안부,행정부,안행부,안전부,1
인사동정 기사에서 기관의 인사 순서는?,기업 학교 병원 언론기관 정부 공공기관(부처청),정부 공공기관(부처청) 기업 학교 병원 언론기관,언론기관 정부 공공기관(부처청) 기업 학교 병원,학교 병원 언론기관 정부 공공기관(부처청) 기업,3
부고 표기 시 사망 일시를 명기하는가?,예 반드시 명기한다.,예 유가족 요청 시 명기한다.,아니오 표기하지 않는다.,예 사망 요인이 중요할 경우 명기한다.,3
부고 기사를 실을 때의 순서 원칙은?,사망자 연령순,사망자 직위순,발인이 빠른 순서,유족이 많은 순서,3
언론인이나 유명인의 부고는 다른 부고보다 어떻게 처리하는가?,다른 부고와 동일하게 처리한다.,다른 부고보다 앞으로 싣는다.,별도 면에 싣는다.,온라인으로만 공개한다.,2
공동 기사 작성 시 기여도가 높은 기자의 바이라인을 적는 원칙에서 일반적인 경우 최대 몇 명까지 표기할 수 있는가?,1 명,2명,3 명,4 명,2
대형 기획 기사 등 예외적인 경우에 공동 기사 바이라인에 몇 명까지 표기할 수 있는가?,1 명,2 명,3명,4 명,3
공동 기사 참여자가 4명 이상일 경우 활용하는 표기 방식은?,대표 기자 1 명만 표기.,모든 참여자를 '외 O 명'으로 표기.,특별취재팀' 표기 방식을 활용해 참여자 모두 적시.,공동취재단'으로 표기.,3
출장이나 특파원 기사의 바이라인 기본 형식은?,이름 (출장지) 아이디@,출장지=이름 아이디@,이름@출장지,(출장지) 이름 아이디,2
