문제,문항1,문항2,문항3,문항4,정답
국내 및 국외 출장(특파원 포함) 간 기자와 기사를 공동 작성할 경우 바이라인 표기 시 출장지 및 세종을 밝혀 적는가?,아니오 생략한다.,예 밝혀 적는다.,오직 국내 출장 시에만 밝혀 적는다.,오직 해외 출장 시에만 밝혀 적는다.,2
아시아경제 소속 기자와 아시아경제 외 계열사 소속 기자가 공동으로 기사를 작성할 경우 바이라인 순서는?,계열사 소속 기자부터,기여도 순으로,아시아경제 소속 기자부터,임의 순서,3
자회사 소속 기자의 이메일 주소 표기 시 이메일 주소 뒷부분(@ 이하)을 생략하는가?,예 생략한다.,아니오 생략하지 않는다.,선택적으로 생략할 수 있다.,아시아경제 소속 기자'만 이메일 주소를 표기한다.,2
해외 출장 기사나 국내 출장 기사에서 바이라인에 나라 이름이나 광역자치단체를 넣는가?,예 항상 넣는다.,예 필요한 경우에만 넣는다.,아니오 넣지 않는다.,해외 기사에만 넣는다.,3
"해외 기사에서 두 개 이상의 출처를 표기할 경우의 바이라인 형식은?,출처 1·출처 2, 도시,도시",출처 1·출처 2,도시=출처 1·출처 2,(도시) 출처 1,출처 2,3
다음 중 **'방증(傍證)'**의 의미로 가장 적절한 것은?,어떤 사실이나 주장이 옳지 아니함을 그에 반대되는 근거를 들어 증명하는 것,사실을 직접 증명하지는 않지만 주변의 상황을 밝힘으로써 간접적으로 증명에 도움을 주는 증거,어떤 사실과 모순되는 것 같지만 오히려 그것을 증명한다고 볼 수 있는 사실,거짓임을 증명하는 명확한 증거,2
다음 중 **'반증(反證)'**의 의미로 모두 해당하는 것은?,사실을 직접 증명하지는 않지만 주변 상황을 통해 간접적으로 증명에 도움을 주는 증거,어떤 사실이나 주장이 옳지 아니함을 그에 반대되는 근거를 들어 증명하는 것,어떤 사실과 모순되는 것 같지만 오히려 그것을 증명한다고 볼 수 있는 사실,b 와 c 모두,4
"""FRB 가 양적완화를 당분간 유지하기로 결정한 것은 미 경기회복세가 충분치 않다는 방증이다.""에서 '방증'의 의미로 올바른 것은?",직접적인 반대 증거,간접적으로 사실을 뒷받침하는 증거,사실이 아님을 증명하는 증거,의도적으로 숨겨진 증거,2
"""이는 되레 메르켈 총리의 강력한 영향력을 보여주는 반증이다.""에서 '반증'의 의미로 올바른 것은?",그녀의 영향력이 없음을 명확히 보여주는 증거,그녀의 영향력에 대한 직접적인 비판,겉으로는 모순되지만 실제로는 영향력을 증명하는 증거,영향력을 부인하는 근거,3
다음 중 앞말이 관형어 구실을 하게 하고 어떤 일이 과거에 완료되지 않고 중단되었다는 미완의 의미를 나타내는 어미는?,~든,~던,~지,~고서,2
다음 중 나열된 동작이나 상태 대상들 중에서 어느 것이든 선택될 수 있음을 나타내는 연결 어미는?,~던,~든,~는,~며,2
"""구글 애드를 통해 등장하는 각종 광고가 과거 검색했던 상품으로 바뀌어 있는 경우들이 좋은 예다.""에서 올바른 표기는?",검색하든,검색할던,검색했던,검색하든지,3
"""'박근혜표 행복주택'이든 '박원순표 임대주택'이든 곳곳에서 파열음이 나고 있다.""에서 밑줄 친 '-든'의 사용이 올바른 이유는?",과거의 일을 회상하기 위함,강조의 의미를 더하기 위함,두 가지 선택지 중 어느 것이든 해당됨을 나타내기 위함,문장의 의미를 명확하게 하기 위함,3
모음이나 'ㄴ' 받침 뒤에 이어지는 '률' 또는 '렬'의 올바른 표기 원칙은?,항상 '률' 또는 '렬'로 쓴다.,율' 또는 '열'로 쓴다.,임의로 선택하여 쓸 수 있다.,해당 단어의 한자음에 따라 결정한다.,2
다음 중 '율' 또는 '열'로 표기해야 하는 경우가 아닌 것은?,모음 뒤에 올 때,ㄴ' 받침 뒤에 올 때,ㄱ' 받침 뒤에 올 때,ㄹ' 받침 뒤에 올 때,3
다음 중 수단이나 도구 재료 등을 나타낼 때 쓰는 표현은?,~로서,~로써,~으로서,~에 의하여,2
"""그녀는 2011 년부터 오픈리치 부문의 최고경영자(CEO)로서 25 억파운드가 투입된 광통신 브로드밴드 출시를 총괄했다.""에서 밑줄 친 '-로서'의 사용이 올바른 이유는?",수단을 나타내기 때문,결과를 나타내기 때문,자격을 나타내기 때문,시간을 나타내기 때문,3
"""국제결제은행(BIS) 기준 자기자본비율을 조작함으로써 법을 위반했다.""에서 밑줄 친 '-으로써'의 사용이 올바른 이유는?",신분을 나타내기 때문,지위를 나타내기 때문,수단이나 방법을 나타내기 때문,이유를 나타내기 때문,3
다음 중 올바른 표기법에 맞는 것은?,구름량,어린이란,알칼리양,가십란,3
다음 중 '거래량'의 표기가 올바른 이유는?,고유어 명사 뒤에 왔기 때문,외래어 명사 뒤에 왔기 때문,한자어 명사 뒤에 왔기 때문,의미 강조를 위함,3
길게 하거나 처지게 하거나 벌여 놓는다는 의미로 쓰이는 동사는?,늘리다,늘이다,늘어지다,늘려주다,2
"다음 중 ""바짓단을 길게 하다""는 의미에 맞는 올바른 표현은?",바짓단을 늘리다,바짓단을 늘이다,바짓단을 늘려 놓다,바짓단을 늘여서,2
"다음 중 ""병력을 증가시키다""는 의미에 맞는 올바른 표현은?",병력을 늘이다,병력을 늘리다,병력을 늘여 놓다,병력을 늘여서,2
부딪다'의 강조 의미로 주어가 직접 행동한 경우에 쓰는 동사는?,부딪히다,부딪치다,부딪히게 하다,부딪게 되다,2
부딪다'의 피동 의미로 주어가 행동을 당한 경우에 쓰는 동사는?,부딪치다,부딪히다,부딪어,부딪고,2
"""파도가 바위에 부딪쳤다""에서 '-쳤다'의 사용이 올바른 이유는?",피동의 의미를 나타내기 때문,파도가 직접 부딪는 행동을 강조하기 때문,바위가 부딪힘을 당했기 때문,문장의 간결성을 위함,2
"""빙산에 부딪혀 배가 침몰했다""에서 '-혀'의 사용이 올바른 이유는?",배가 직접 부딪는 행동을 강조하기 때문,배가 빙산에 의해 부딪힘을 당했기 때문,배가 빙산과 의도적으로 충돌했기 때문,동사의 변화형을 나타내기 위함,2
다음 중 올바른 한국어 표기는?,몇 일,며칠,몇 일째,며칠째로,2
겹겹이 포개어 얹어 놓거나 명예 신뢰를 얻는다는 뜻의 피동형은?,쌓이다,싸이다,싸여있다,쌓여있다,1
씌워 가리거나 둘러 말거나 뒤덮는다는 뜻의 피동형은?,쌓이다,싸이다,싸여있다,쌓여있다,2
"""책상에 먼지가 쌓이다.""에서 밑줄 친 동사의 사용이 올바른 이유는?",먼지가 책상 위를 덮었기 때문,먼지가 겹겹이 포개어져서 놓였기 때문,먼지가 책상을 감쌌기 때문,먼지가 책상에 스며들었기 때문,2
"""슬픔(의혹)에 싸이다.""에서 밑줄 친 동사의 사용이 올바른 이유는?",슬픔이 겹겹이 쌓였기 때문,슬픔이 마음을 뒤덮거나 감쌌기 때문,슬픔이 축적되었기 때문,슬픔이 명확히 드러났기 때문,2
눈에 보이다' 또는 '공간적으로나 시간적으로 사이가 떨어지게 하다'의 의미로 쓰이는 동사는?,띠다,띄다,띄우다,뜨이다,2
용무 직책 사명 따위를 맡아 지니다' 또는 '빛깔이나 색채 따위를 가지다'의 의미로 쓰이는 동사는?,띄다,띠다,띠우다,따르다,2
"""그는 번번이 좋은 기회를 다 놓쳤다.""에서 밑줄 친 '번번이'의 올바른 의미는?,기회가 평평하게 놓였다",기회가 반듯하게 놓였다,매번,여러 번 기회를 놓쳤다,기회가 구김살 없이 놓였다,3
다음 중 자격이나 신분 지위를 나타낼 때 쓰는 표현은?,~로써,~로서,~으로써는,~에게서,2